"Show_Name","startYear","Episode_Name","seasonNumber","episodeNumber_in_season","episodeNumber_overall","averageRating","numVotes","tconst","parentTconst"
"Paranormal",2020,"The Myth of the House",1,1,1,8.5,7645,"tt13218110","tt12411074"
"Paranormal",2020,"The Myth of the Curse of the Pharaoh",1,2,2,8,7044,"tt13218162","tt12411074"
"Paranormal",2020,"The Myth of the Guardian of The Cave",1,3,3,7.1,7066,"tt13218174","tt12411074"
"Paranormal",2020,"The Myth of the Naiad",1,4,4,8.5,6964,"tt13218178","tt12411074"
"Paranormal",2020,"The Myth of the Incubus",1,5,5,9,7177,"tt13218180","tt12411074"
"Paranormal",2020,"The Myth of the House: The Return",1,6,6,9.3,7742,"tt13218186","tt12411074"
