"Show_Name","startYear","Episode_Name","seasonNumber","episodeNumber_in_season","episodeNumber_overall","averageRating","numVotes","tconst","parentTconst"
"Dead Boy Detectives",2024,"The Case of Crystal Palace",1,1,1,7.6,1332,"tt15359240","tt15358446"
"Dead Boy Detectives",2024,"The Case of the Dandelion Shrine",1,2,2,7.6,1161,"tt19710290","tt15358446"
"Dead Boy Detectives",2024,"The Case of the Devlin House",1,3,3,8,1101,"tt19710292","tt15358446"
"Dead Boy Detectives",2024,"The Case of the Lighthouse Leapers",1,4,4,7.8,1037,"tt19710300","tt15358446"
"Dead Boy Detectives",2024,"The Case of the Two Dead Dragons",1,5,5,7.7,1020,"tt19710296","tt15358446"
"Dead Boy Detectives",2024,"The Case of the Creeping Forest",1,6,6,7.9,982,"tt19710286","tt15358446"
"Dead Boy Detectives",2024,"The Case of the Very Long Stairway",1,7,7,8.4,1091,"tt19710302","tt15358446"
"Dead Boy Detectives",2024,"The Case of the Hungry Snake",1,8,8,8.2,1026,"tt19710298","tt15358446"
