"Show_Name","startYear","Episode_Name","seasonNumber","episodeNumber_in_season","episodeNumber_overall","averageRating","numVotes","tconst","parentTconst"
"Berlin",2023,"La energía del amor",1,1,1,7.2,1396,"tt16304556","tt16288804"
"Berlin",2023,"El ancla y el lobo",1,2,2,7.3,1252,"tt22488406","tt16288804"
"Berlin",2023,"Póker de embriones",1,3,3,7,1164,"tt22488396","tt16288804"
"Berlin",2023,"Un aquarium en la espalda",1,4,4,7.4,1161,"tt22488394","tt16288804"
"Berlin",2023,"After Love",1,5,5,6.1,1286,"tt22488400","tt16288804"
"Berlin",2023,"La noche de los limones",1,6,6,7.1,1079,"tt22488398","tt16288804"
"Berlin",2023,"La última virgen de occidente",1,7,7,7.3,1105,"tt22488404","tt16288804"
"Berlin",2023,"Un elefante en peligro de extinción",1,8,8,7.7,1257,"tt22488402","tt16288804"
