"Show_Name","startYear","Episode_Name","seasonNumber","episodeNumber_in_season","episodeNumber_overall","averageRating","numVotes","tconst","parentTconst"
"Death's Game",2023,"Death",1,1,1,8.1,656,"tt26629550","tt26225038"
"Death's Game",2023,"The Reason You're Going to Hell",1,2,2,8.4,628,"tt26629549","tt26225038"
"Death's Game",2023,"Death Can't Take Anything Away",1,3,3,8.5,656,"tt26629551","tt26225038"
"Death's Game",2023,"The Reason You're Afraid of Death",1,4,4,9,855,"tt26629552","tt26225038"
"Death's Game",2023,"It Is Impossible to Break Free and Fight against Death",1,5,5,8.4,515,"tt26629553","tt26225038"
"Death's Game",2023,"Memory",1,6,6,8.5,507,"tt26629554","tt26225038"
"Death's Game",2023,"Opportunity",1,7,7,8.1,484,"tt26629555","tt26225038"
"Death's Game",2023,"Don't Go Looking For Death. Death Will Come Find You",1,8,8,8.3,585,"tt29632226","tt26225038"
