"Show_Name","startYear","Episode_Name","seasonNumber","episodeNumber_in_season","episodeNumber_overall","averageRating","numVotes","tconst","parentTconst"
"Inhumans",2017,"Behold... The Inhumans",1,1,1,6,2037,"tt6263404","tt4154858"
"Inhumans",2017,"Those Who Would Destroy Us",1,2,2,6,1748,"tt6263408","tt4154858"
"Inhumans",2017,"Divide - and Conquer",1,3,3,6.1,1454,"tt6263412","tt4154858"
"Inhumans",2017,"Make Way for... Medusa",1,4,4,6,1328,"tt6263416","tt4154858"
"Inhumans",2017,"Something Inhuman This Way Comes...",1,5,5,6.1,1236,"tt6263420","tt4154858"
"Inhumans",2017,"The Gentleman's Name is Gorgon",1,6,6,6,1168,"tt6263424","tt4154858"
"Inhumans",2017,"Havoc in the Hidden Land",1,7,7,6,1113,"tt6263430","tt4154858"
"Inhumans",2017,"...And Finally: Black Bolt",1,8,8,6,1108,"tt6263436","tt4154858"
